,index,page,type,intervals,text,x1,y1,x2,y2,block_type,block_id
78,45,6,Paragraph,"[(934, 943), (943, 955), (955, 968), (968, 982), (982, 991), (991, 1003), (1003, 1015), (1015, 1024), (1024, 1036), (1036, 1045), (1045, 1055), (1055, 1063), (1063, 1072), (1072, 1083), (1083, 1093), (1093, 1107), (1107, 1118), (1118, 1123)]","Secondly, Tabs.do proactively estimates the reading progress of each tab to help users remember the level of progress they had made (Figure 1 F “21%”). To do so, Tabs.do tracks the scroll position and focus state of each tab using the scroll , blur , and focus JavaScript events. Combined with the tab’s viewport height, Tabs.do gener- ates a heat map in the background of how many seconds different regions on the webpage were in the viewport while the tab was in focus. Finally, Tabs.do generates a reading progress estimation based on the heat map assuming users process 100 vertical pixels per second. While there may be other more sophisticated approaches for progress estimation, such as analyzing page content [25], this simple heuristic was straightforward to implement, required mini- mal computing resources at runtime, and worked reasonably well during our own testing. This estimation is calculated locally on all open tabs, but only synchronized with the backend database for tabs that the user had saved to Tabs.do. This is so we only obtain information for tabs that users had explicitly saved into our system to avoid tracking private information.",0.51909477124183,0.537965404040404,0.9178257867921571,0.7845164141414142,,
79,46,6,Section,"(1123, 1126)",4.5 [D3] Prioritizing,0.5195343137254902,0.8045840103535353,0.6644152614379085,0.8171630507575758,,
80,47,6,Paragraph,"[(1126, 1139), (1139, 1149), (1149, 1156), (1156, 1166), (1166, 1167)]","One issue with the current browser tab design is that it does not reflect users varying task types and priorities. More specifically, tabs represent frequently visited references, important but unfinished tasks, or casual readings picked up from social media. However, 7",0.49721895424836604,0.8201573232323233,0.9169550497254905,0.9031792929292929,,
81,48,7,Header,"[(0, 8), (8, 15)]","UIST ’21, October 10–14, 2021, Virtual Event, USA Chang, Kim, Miller, Liu, Myers and Kittur",0.08465032679738561,0.0720265032828283,0.9153500186274508,0.0808318063131313,,
82,49,7,Paragraph,"[(15, 25), (25, 37), (37, 48), (48, 57), (57, 62)]","besides favicons, tabs have the same visual saliency (i.e., tab-width), making it difficult for users to prioritize their tasks and focus on the task at hand [13]. Tabs.do addresses this by providing four prioritization mechanisms that can be flexibly combined to address different user needs (Figure 4):",0.08465032679738561,0.10063333333333331,0.48207868130718967,0.16730176767676774,,
83,49,7,Paragraph,"[(62, 73), (73, 85), (85, 95), (95, 105), (105, 114), (114, 125), (125, 134), (134, 146), (146, 158), (158, 171), (171, 174)]","Status-based : Tabs.do allows users to categorize their tabs into five general statuses (Figure 4 A) indicated by the leading icon of each saved tab: to-do (circle icon), to-read (book icon), reference (book- mark icon), completed (check icon), and deleted (trash icon). Saved tabs are automatically sorted under collapsible sections based on their statuses. References are sorted at the top for quick access, followed by to-do, to-read, completed, and deleted. The completed sections are collapsed by default so that they do not distract users from their primary tasks (Figure 4 E), and deleted items are moved into a global Trash Can view accessible from the menu on the left (Figure 1 A).",0.08421078431372549,0.17768005050505042,0.48294436378562094,0.3273712121212122,,
84,49,7,Paragraph,"[(174, 185), (185, 198), (198, 209), (209, 221), (221, 235), (235, 241)]","Priority-based : Users can prioritize their tabs by assigning priority 1 to priority 3 (Figure 4 D), which changes the color of their status icon from gray to red, yellow, and blue, respectively. The priorities are used as a secondary sort key; within each status section, priority 1 tabs are sorted to the top of the section, followed by priority 2, priority 3, and default priority (unassigned).",0.08431372549019608,0.33774823232323226,0.48207817349019616,0.41825505050505046,,
85,49,7,Paragraph,"[(241, 244), (244, 259), (259, 272), (272, 286), (286, 296)]","Schedule-based :Analternativewayto prioritizetabssavedinTabs.do is to assign a due date to them. Tabs with a due date assigned to them have a calendar icon under their title, followed by the due date. Scheduling a tab does not change its order, but puts it into a global scheduling view accessible from the menu on the left side.",0.08465032679738561,0.42863207070707066,0.48272478954248393,0.49530176767676765,,
86,49,7,Paragraph,"[(296, 306), (306, 316), (316, 329), (329, 341), (341, 350), (350, 363), (363, 373), (373, 386), (386, 400), (400, 411), (411, 421), (421, 431), (431, 441), (441, 455), (455, 461)]","Someday/Maybe : Prior studies in both general task management and browser tab management have identified that some users tend to keep low-priority tasks or tabs that they do not expect to ever com- plete [6, 13]. To prevent low priority tasks creating clutter in users’ workspaces, Tabs.do allows users to mark tasks as Someday/Maybe which moves them to the bottom of their project view (Figure 4 E). Similar to completed tasks, Someday tasks are collapsed by default to prevent clutter. One challenge here is that users do not want their tasks out of sight (e.g., such as if saved as bookmarks) to avoid the “black-hole” effect in which when tasks become out of sight, the chances of completing them are significantly reduced [13]. For this, Tabs.do encourages users to mark their tasks as Someday/Maybe by showing a random low-priority item every time users open their project so that they are not entirely out of sight (Figure 4 E), yet also do not clutter users’ workspaces.",0.08299509803921569,0.5056800505050505,0.48293525087581723,0.7107184343434344,,
87,49,7,Paragraph,"[(461, 471), (471, 483), (483, 492), (492, 502), (502, 512), (512, 516)]","While we provided four mechanisms for prioritizing tasks in Tabs.do, we do not expect users to utilize all four mechanisms. Instead, our goal was to provide prioritization mechanisms flexible enough to accommodate different users, as prior work in general task manage- ment has pointed to users having varying strategies when prioritiz- ing their tasks [30].",0.08394607843137254,0.7210967171717172,0.48294015895424863,0.8016022727272728,,
88,50,7,Section,"(516, 521)",4.6 Automatic Task Bundle Suggestions,0.08465032679738561,0.8184211315656565,0.35995668496732036,0.8310001719696969,,
89,51,7,Paragraph,"[(521, 532), (532, 544), (544, 555)]","To lower the user costs of adopting the system, Tabs.do provides tab grouping suggestions to make it easier for users to save tab bundles into the system. Driving this feature is a deep learning",0.08421078431372549,0.8339931818181818,0.48047205479738575,0.8729886363636364,,
90,51,7,Paragraph,"[(555, 563), (563, 572), (572, 584), (584, 596), (596, 605)]","model that segments browsing history into sessions containing page-loads supporting the same tasks. While page-loads are not equivalent to tabs (i.e., a user could load multiple pages over time in the same tab), this approach allowed us to more easily collect training data using the Browser Extensions History APIs. 3",0.5195343137254902,0.10063333333333331,0.9153560417254905,0.16730176767676774,,
91,51,7,Paragraph,"[(605, 619), (619, 629), (629, 637), (637, 649), (649, 661), (661, 673), (673, 684), (684, 695), (695, 707), (707, 718), (718, 728), (728, 742), (742, 753), (753, 763), (763, 774), (774, 787)]","We collected a small set of labels to train and test our model where four research team members (a designer, a product manager, and two researchers) provided their recent browsing history resulting in a total of 2,278 page-loads. The first two authors went through each page load in their history to identify whether it was either the beginning of a new task session or not. To ensure labeling consistency, the first two authors first labeled 10.9% of the data independently and compared their labels. The two sets of labels had a high agreement level (Cohen’s k = 0.901, p<0.00001, N=248), so they proceeded to label the rest of the dataset without duplication. After labeling all 2,278 page-loads, 23.8% were labeled as the beginning of a new task session. We used the labeled dataset to train a simple feed-forward network with three hidden layers of 32, 64, 128 nodes, respectively, and used ReLu6 as the activation function [36]. We used the below six features to make predictions about whether a page-load in history is the beginning of a new task session or not.",0.5188316993464052,0.1784060606060606,0.9169626682352943,0.3972828282828283,,
92,52,7,List,"[(787, 796), (796, 804), (804, 813), (813, 817), (817, 826), (826, 830), (830, 840), (840, 849), (849, 861), (861, 873), (873, 883)]",(1) Title similarity based on Universal Sentence Embedding vectors [12] between the current and previous page load (2) Normalized Levenstein distance between the URLs of current and previous page load (3) Normalized Levenstein distance between the domains of current and previous page load (4) Whether the current page load was a Google search (5) Whether the previous page-load was a Google search (6) The number of times this URL was visited in the past (7) The number of times URL was entered in the address bar (8) Seconds between the current and the previous page load,0.5210833333333332,0.4083871212121212,0.9153546642614381,0.6181994949494951,,
93,53,7,Paragraph,"[(883, 892), (892, 904), (904, 914), (914, 927), (927, 936), (936, 948), (948, 961), (961, 973), (973, 983), (983, 995), (995, 1005), (1005, 1015), (1015, 1026), (1026, 1038), (1038, 1050)]","These included features based on semantic similarity between the page load and its previous page load (features 1 through 5) and behavioral features based on users’ past interactions with the web- page (features 6 through 8). Features 1 to 3 were designed to capture task topic changes by measuring the semantic similarity between titles, URLs, and domain names [12]. Features 4 and 5 were based on the intuition that many online tasks begin with a web search to fulfill some information needs. Features 6 and 7 were based on the intuition that frequently visited portal pages, such as Google Drive, are often used as task launchers. Finally, feature 8 was a feature commonly used by search engines for identifying new search topics [35]. At runtime, the model makes predictions on users’ browsing history that covers their open tabs. We then extract query terms from any Google search results pages to use as the suggested bundle name, and if there were no Google search results pages within the",0.51909477124183,0.6293037878787878,0.9178332294901963,0.8343434343434343,,
94,54,7,Footnote,"[(1050, 1052)]",3 https://developer.mozilla.org/en-US/docs/Mozilla/Add-ons/WebExtensions/API/history,0.5195343137254902,0.8523566919191919,0.904397569908497,0.8729886363636364,,
95,55,7,Paragraph,"[(1052, 1053)]",8,0.4973513071895424,0.8943739898989899,0.5026500277777777,0.9031792929292929,,
96,56,8,Caption,"[(0, 5)]",Tabs.do: Task-Centric Browser Tab Management,0.08434150326797385,0.0720265032828283,0.3119813767973856,0.0808318063131313,,
97,57,8,Header,"[(5, 13)]","UIST ’21, October 10–14, 2021, Virtual Event, USA",0.6822878777777778,0.0720265032828283,0.9153518179738558,0.0808318063131313,,
98,58,8,Paragraph,"[(13, 26), (26, 27)]","suggested tab bundle, we use the title of the first tab within that bundle.",0.08465032679738561,0.10063333333333331,0.48047205479738586,0.125790404040404,,
99,58,8,Paragraph,"[(27, 36), (36, 46), (46, 57), (57, 67), (67, 78), (78, 87), (87, 97), (97, 109), (109, 121), (121, 131), (131, 141), (141, 151), (151, 159), (159, 172), (172, 182), (182, 197), (197, 208), (208, 218)]","4.6.1 Prediction Accuracy. We randomly sampled 80% of labeled data for training, 10% for validation to prevent over-fitting, and 10% for testing model accuracy. The complete model trained on all eight features had an overall labeling accuracy of 92.1% (precision: 0.86; recall: 0.83; F1: 0.84 for the start-of-task label). We further compared the labeling accuracy for using only semantic features versus only behavioral data. Results showed that the model trained on semantic features (1 through 5) had a labeling accuracy of 76.3%, and the model trained on behavioral features (6 through 8) had a labeling accuracy of 86.4%. This result suggests that both semantic and behavioral features contributed to the higher accuracy of the model trained on all features. To reduce model complexity and improve runtime efficiency, we iterated through different feature combinations to see if we can use only a subset of features and achieve similar performance to the complete model. In the end, we used feature 1, 2, 3, 4, and 8 to generate the model we used in the extension, which had an overall labeling accuracy of 90.8% (precision: 0.84; recall: 0.79; F1: 0.81 for the start-of-task label).",0.08410784313725489,0.13664090909090912,0.48219237291503286,0.3831906565656566,,
100,58,8,Paragraph,"[(218, 229), (229, 242), (242, 256), (256, 265), (265, 277), (277, 291), (291, 305), (305, 314), (314, 324), (324, 334), (334, 342), (342, 350)]","We acknowledge that this preliminary result was limited by the size of our dataset, and the accuracy of the model in a field deployment will likely be lower than on the test set due to behavioral and task topics differences between individuals. To address this, the Open Tabs pane (Figure 2 A) allows users to recover from the model’s mistakes by first clicking on a bundle’s title to select all tabs in it, and then unselect tabs that do not belong in the same task, or select additional tabs to include them. While more sophisticated models with larger training data could further improve accuracy, in this current work, we focused on examining the effects of providing automatic task bundling suggestions on user experience holistically by conducting a field deployment study of Tabs.do.",0.08394607843137254,0.39403989898989894,0.4820710627973859,0.5575681818181818,,
101,59,8,Section,"(350, 353)",4.7 Implementation Notes,0.08465032679738561,0.5748580002525253,0.2701467761437908,0.5874370406565657,,
102,60,8,Paragraph,"[(353, 366), (366, 375), (375, 386), (386, 397), (397, 405), (405, 416), (416, 428), (428, 436), (436, 447), (447, 449)]","In order to produce a research prototype that is robust enough for a field deployment study, we spent eight months developing Tabs.do as a browser extension while the research team used the extension ourselves for the last four months to identify bugs and usability issues. Admittedly, modifying the browser program would have allowed us to explore the design space of changing existing tab interfaces, but we think it is a reasonable trade-off for the signifi- cantly lowered development effort required for browser extensions and is also sufficient to test our task-centric approach for managing browser tabs.",0.08465032679738561,0.5904313131313131,0.48293781479738573,0.7262853535353535,,
103,60,8,Paragraph,"[(449, 458), (458, 470), (470, 479), (479, 487), (487, 497), (497, 508), (508, 518), (518, 526), (526, 536), (536, 545)]","Tabs.do was implemented in approximately 13,000 lines of Type- Script and used the ReactJS library and the Bulma CSS framework for building UI components. Firestore was used for backend functions, database, and user authentication, which allowed our participants to access their tabs across devices. For privacy concerns, Tensor- FlowJS was used to drive the task bundle prediction feature [48], which allowed Tabs.do to make tab grouping predictions locally on participants’ computers without sending their open tab information to a backend server. Tabs.do was implemented as a cross-platform browser extension using the now standardized Web Extensions APIs,",0.08410784313725489,0.737134595959596,0.4829465923137256,0.8729886363636364,,
104,60,8,Paragraph,"[(545, 556), (556, 566), (566, 573)]",but we only recruited participants who used Google Chrome and Mi- crosoft Edge as their primary browsers during the field deployment study to minimize testing efforts during development.,0.5195343137254902,0.10063333333333331,0.9178241458823532,0.1396275252525253,,
105,61,8,Section,"(573, 577)",5 FIELD DEPLOYMENT STUDY,0.5195343137254902,0.16808148510101004,0.7456299859477125,0.18066052550505052,,
106,62,8,Paragraph,"[(577, 587), (587, 597), (597, 607), (607, 618), (618, 629), (629, 640), (640, 650), (650, 674), (674, 686), (686, 695), (695, 706), (706, 716), (716, 725), (725, 734), (734, 743), (743, 753), (753, 762), (762, 770), (770, 780), (780, 791), (791, 803), (803, 814), (814, 824), (824, 836), (836, 845), (845, 853), (853, 861), (861, 872), (872, 881), (881, 882)]","To understand how our task-centric approach can benefit users and to evaluate Tabs.do, we conducted a field deployment with partici- pants performing their everyday tasks in the wild. Ten participants were recruited by posting to authors’ social media feeds and online forums (mean age: 29.70; SD=8.97; 6 male, 3 female, 1 non-binary; 4 students, 3 software engineers, 1 faculty, 1 account manager, 1 entrepreneur). The posts were brief and asked for participants who have ever “ felt overwhelmed by their browser tabs .” The posts also contained a link to an online screener survey to recruit participants who used Chrome or Edge as their primary browsers which were the two browsers that we tested during development. Each participant was interviewed remotely before using Tabs.do and after using it via a video conferencing service that supported screen sharing. The pre- interviews lasted around 20 minutes which covered collecting their consent and demographic information, a brief walk-through of the interface, and installing the extension on their personal computers. We then scheduled each participant for a 30 minute post-interview approximately one week after installation, determined by their avail- ability. During the post-interviews, participants shared their screen and performed a retrospective walk-through of their usage of the system. All 10 participants completed the study and were each com- pensated a 50 USD Amazon gift card for their time. The interviews were recorded (both audio and video) and transcribed for an open coding analysis to capture rich qualitative insights grounded in data [9, 17]. The first author went through the 5 hours of recordings and transcriptions in three passes to iteratively highlight interest- ing quotes, generating summaries and potential categories until clear high-level themes emerged. Throughout the iterations, inputs from the third author who conducted the interviews were also in- corporated. This study was approved by our institutional review board.",0.5188316993464052,0.183654797979798,0.9178250542431374,0.6100858585858586,,
107,63,8,Section,"(882, 884)",5.1 Results,0.5195343137254902,0.6385398184343435,0.6029466705882353,0.6511188588383838,,
108,64,8,Paragraph,"[(884, 893), (893, 902), (902, 912), (912, 922), (922, 932), (932, 945), (945, 956), (956, 971), (971, 983), (983, 993), (993, 1006), (1006, 1014), (1014, 1025), (1025, 1034), (1034, 1044), (1044, 1046)]","In general, participants responded favorably in the interviews about their experience with Tabs.do during the week-long study, using Tabs.do to manage their tabs supporting both their personal and professional tasks in the wild. Log data showed that participants were actively engaged with the system during the week-long de- ployment (Table 1). We examined the log data and found that 7 out of the 10 participants continued to be actively engaged with Tabs.do on a daily basis at the time of writing (or for more than 10 weeks total). Considering participants still had to endure a few bugs in our research prototype and were under no obligation nor rewards for the continued usage after the study had concluded, we see this as an encouraging indication that our task-centric approach continued to provide value to our participants. Below we list the most common themes from coding the interviews to provide in-depth understand- ings of how participants interacted with Tabs.do during the field deployment study.",0.5189918300653594,0.6541131313131313,0.9178336397176472,0.8729886363636364,,
109,64,8,Paragraph,"[(1046, 1047)]",9,0.4973513071895424,0.8943739898989899,0.5026500277777777,0.9031792929292929,,
110,65,9,Header,"[(0, 8), (8, 15)]","UIST ’21, October 10–14, 2021, Virtual Event, USA Chang, Kim, Miller, Liu, Myers and Kittur",0.08465032679738561,0.0720265032828283,0.9153500186274508,0.0808318063131313,,
111,66,9,Paragraph,"[(15, 17), (17, 18), (18, 19), (19, 20), (20, 21), (21, 22), (22, 23), (23, 24), (24, 25), (25, 27), (27, 28), (28, 29), (29, 33), (33, 38), (38, 39), (39, 40), (40, 41), (41, 42), (42, 43), (43, 44), (44, 45), (45, 46), (46, 47), (47, 50), (50, 52), (52, 53), (53, 54), (54, 55), (55, 56), (56, 57), (57, 58), (58, 59), (59, 60), (60, 61), (61, 64), (64, 65), (65, 66), (66, 67), (67, 68), (68, 69), (69, 70), (70, 71), (71, 72), (72, 73), (73, 74), (74, 77), (77, 79), (79, 80), (80, 81), (81, 82), (82, 83), (83, 84), (84, 85), (85, 86), (86, 87), (87, 88), (88, 89), (89, 90), (90, 91), (91, 95), (95, 97), (97, 98), (98, 99), (99, 100), (100, 101), (101, 102), (102, 103), (103, 104), (104, 105), (105, 106), (106, 107), (107, 108), (108, 109), (109, 112), (112, 113), (113, 114), (114, 115), (115, 116), (116, 117), (117, 118), (118, 119), (119, 120), (120, 121), (121, 124), (124, 125), (125, 126), (126, 127), (127, 128), (128, 129), (129, 130), (130, 131), (131, 132), (132, 133), (133, 134), (134, 137), (137, 139), (139, 140), (140, 141), (141, 142), (142, 143), (143, 144), (144, 145), (145, 146), (146, 147), (147, 148), (148, 151), (151, 153), (153, 154), (154, 155), (155, 156), (156, 157), (157, 158), (158, 159), (159, 160), (160, 161), (161, 162), (162, 163), (163, 164), (164, 165), (165, 169), (169, 173), (173, 174), (174, 175), (175, 176), (176, 177), (177, 178), (178, 179), (179, 180), (180, 181), (181, 182), (182, 183), (183, 185), (185, 187), (187, 188), (188, 189), (189, 190), (190, 191), (191, 192), (192, 193), (193, 194), (194, 195), (195, 196), (196, 199), (199, 200), (200, 201), (201, 202), (202, 203), (203, 204), (204, 205), (205, 206), (206, 207), (207, 208), (208, 209), (209, 212), (212, 217), (217, 220), (220, 222), (222, 223), (223, 224), (224, 225), (225, 226), (226, 227), (227, 228), (228, 229), (229, 230), (230, 231), (231, 232), (232, 234), (234, 236), (236, 237), (237, 238), (238, 239), (239, 240), (240, 241), (241, 242), (242, 243), (243, 244), (244, 245), (245, 246), (246, 247), (247, 248)]",Action Count P1 P2 P3 P4 P5 P6 P7 P8 P9 P10 M SD S e ss i o n New Tab Page 58 11 21 15 28 11 22 28 11 3 20.8 15.4 Popup View 19 4 39 4 7 3 6 4 14 11 11.1 11.1 Total 77 15 60 19 35 14 28 32 25 14 31.9 21.1 Create Project 11 1 5 6 4 4 2 1 4 2 4.0 3.0 T a s k Create Manually 10 5 8 10 10 8 4 8 8 2 7.3 2.8 Save Open Tabs 63 19 50 70 49 37 11 47 78 11 43.5 23.8 Total 73 24 58 80 59 45 15 55 86 13 50.8 26.2 Nest Tasks 65 33 36 48 75 44 8 49 86 10 45.4 25.4 Edit Notes 7 7 2 0 12 7 7 2 0 12 5.6 4.5 R e o p e n Individual Tabs 42 2 7 4 3 6 14 13 6 1 9.8 12.1 From Bundles 25 13 12 0 12 7 2 5 95 4 17.5 28.2 Total 67 15 19 4 15 13 16 18 101 5 27.3 31.3 P r i o r i t y Set Status 10 1 27 30 11 5 1 11 1 3 10 10.6 Set Priority 1 3 1 3 12 5 0 4 0 5 3.4 3.6,0.187607831862745,0.10085838181818173,0.8110413254901961,0.3279671717171717,,
112,67,9,Table,"[(248, 251), (251, 252), (252, 253), (253, 254), (254, 255), (255, 256), (256, 257), (257, 258), (258, 259), (259, 260), (260, 261), (261, 262), (262, 263), (263, 265), (265, 266), (266, 267), (267, 268), (268, 269), (269, 270), (270, 271), (271, 272), (272, 273), (273, 274), (274, 275), (275, 276), (276, 277), (277, 278), (278, 279), (279, 280), (280, 281), (281, 282), (282, 283), (283, 284), (284, 285), (285, 286), (286, 287), (287, 290), (290, 294), (294, 303), (303, 306)]",Set Due Date 1 1 2 8 31 3 4 0 0 0 5 9.5 Set Maybe/Someday 1 2 0 1 2 3 2 12 0 2 2.5 3.5 Total 13 7 30 42 56 16 7 27 1 10 20.9 17.6 Total Usage in Minutes 49.6 13.1 31.2 43.6 51.4 24.3 21.5 20.7 27.2 16.0 29.9 13.8,0.19108986928104577,0.30831388888888867,0.8110461045751635,0.36164898989898986,,
113,68,9,Caption,"[(306, 358), (358, 419), (419, 430)]","Table 1. Behavioral log data from participants in the field deployment study. Session: The number of times participants opened and interacted with Tabs.do, either from the new tab page (Figure 1) or the popup view (Figure 3). Tasks: The number of times participants created a manual task or saved an open tab. Nest Tasks: the number of times a task was nested under another; for example, if a bundle with 5 tabs were saved, it counts as saving and nesting 5 tabs. Reopen: number of tabs opened from Tabs.do either by clicking on the title of a tab or using the reopen button on a bundle (Figure 4 E). For example, if a bundle with 5 tabs were reopened, it counts as 5 openings.",0.08429901960784314,0.36868789608585856,0.9173590298032681,0.4290680728535353,Table,5.0
