,index,page,type,intervals,text,x1,y1,x2,y2,block_type,block_id
39,26,3,Paragraph,"[(431, 442), (442, 454), (454, 463), (463, 474), (474, 482), (482, 493), (493, 503), (503, 517), (517, 529), (529, 530)]","Secondly, [13] pointed to how users manage their attention at the task level, yet the current browser design makes it costly for users to context-switch between sets of tabs supporting their different tasks. While built-in features such as Chrome’s tab groups and tab management extensions such as Workona support creating task contexts from multiple tabs, the initial manual cost of grouping tabs to create them can be prohibitively high. Specifically, when creating a new task context, users would still need to go through each of their open tabs to gather ones that are relevant to avoid losing important tabs.",0.08465032679738561,0.737134595959596,0.4808456547973857,0.8729886363636364,,
40,26,3,Paragraph,"[(530, 540), (540, 549), (549, 561), (561, 574), (574, 585), (585, 597), (597, 609), (609, 614)]","Thirdly, [13] found participants had tabs that corresponded to tasks of varying importance, ranging from urgent and important tasks to casual readings that they may never get to but nonetheless did not want to put out of sight for fear of never re-encountering them. However, browser tabs have the same visual saliency (i.e., the same tab-width) and are ordered by default by creation time in a simple list, making it difficult for users to prioritize their tabs and focus their attention on important tasks.",0.51909477124183,0.10063333333333331,0.9176044983843138,0.2088131313131313,,
41,26,3,Paragraph,"[(614, 625), (625, 630)]","Motivated by the three core issues summarized above, we list our core design goals as follows:",0.5195343137254902,0.219370707070707,0.9156314801568631,0.24452904040404044,,
42,27,3,List,"[(630, 642), (642, 647), (647, 659), (659, 665), (665, 676), (676, 683)]",• [D1] Allow users to group tabs into task bundles and context- switch at the task level. • [D2] Allow users to create rich and fluid structures that better reflect their evolving task mental models. • [D3] Allow users to prioritize and de-prioritize their tabs so they can focus on their important tasks.,0.5293464052287581,0.25508661616161615,0.9178231652287583,0.3516755050505051,,
43,28,3,Section,"(683, 692)",4 SYSTEM DESIGN 4.1 Fundamental Primitives and Design Approach,0.5195343137254902,0.3686736568181819,0.8637486552287581,0.3998069901515152,,
44,29,3,Paragraph,"[(692, 701), (701, 716), (716, 729), (729, 742), (742, 755), (755, 769), (769, 779), (779, 791), (791, 804), (804, 817), (817, 827), (827, 841), (841, 853), (853, 863), (863, 876), (876, 884)]","The fundamental primitive that Tabs.do introduces to support the above design goals is the tab bundle . A tab bundle can hold zero or more tabs and zero or more tab bundles, which can be nested to an arbitrary level of depth via drag and drop (Figure 2). If empty, a tab bundle consists only of a text title, which essentially acts as a to-do item as found in a typical to-do manager (Figure 2 C). Tab bundles have a variety of task functionality as described below. When containing one tab, the bundle is displayed and acts like a single tab (Figure 2 D), though it supports the same set of task functionality as when it is shown as a to-do. However, a tab bundle becomes particularly useful when it contains multiple tabs (Figure 2 E), at which point the entire bundle can be treated as a single task, and can be assigned a priority, scheduled (Figure 4), moved into a project (Figure 1), or otherwise managed as a task. Furthermore, tab bundles can be nested in other tab bundles to an arbitrary level (Figure 2), supporting complex task and subtask structures.",0.5188316993464052,0.40279999999999994,0.9176125857254903,0.6216767676767677,,
45,29,3,Paragraph,"[(884, 894), (894, 905), (905, 916), (916, 928), (928, 941), (941, 954), (954, 966), (966, 976), (976, 988), (988, 1001), (1001, 1013), (1013, 1023), (1023, 1038), (1038, 1049), (1049, 1058)]","There are several common user patterns Tabs.do supports for trans- forming tabs into tasks and managing them using tab bundles. One approach is post-hoc task management, in which a user has already started a task through a search query and may have several tabs opened from that query or related pages. In this case a user can open the Tabs.do interface by opening a new tab page (see Figure 1), selecting the tabs they wish to bundle from the “Open tabs” pane (which can be auto-suggested by the system, as described below), and dragging them into another pane. At this point the system will create a bundle for them named using the terms of the search query it originated from if available (shown in previous work to be an effective heuristic for initial naming of search-based tasks [29]), or else the title of the first tab in the bundle. The user can then close the related tabs, while managing the task through the bundle’s task functionality or resuming the bundled task when they wish.",0.51909477124183,0.6322343434343435,0.9178197668183006,0.8372727272727273,,
46,29,3,Paragraph,"[(1058, 1069), (1069, 1081)]","Another common approach discussed in the literature is a priori task management, in which a user creates a placeholder for a task that",0.5190212418300654,0.8478303030303029,0.9157316983006538,0.8729886363636364,,
47,29,3,Paragraph,"[(1081, 1082)]",4,0.49721895424836604,0.8943739898989899,0.5025176748366014,0.9031792929292929,,
48,30,4,Header,"[(0, 5), (5, 13)]","Tabs.do: Task-Centric Browser Tab Management UIST ’21, October 10–14, 2021, Virtual Event, USA",0.08434150326797385,0.0720265032828283,0.9153518179738558,0.0808318063131313,,
49,31,4,Caption,"[(13, 70), (70, 119)]","Fig. 2. Users create and organize their tabs via drag and drop into their projects. They could create hierarchy from previously saved tabs or new tabs by dragging to a specific location in their task hierarchy from their open tab list in [A]. [A] A User drags a tab grouping suggestion from the Open Tabs view into a specific location [B] in the task hierarchy. When dragging, the light green background indicates the selected tabs that are being dragged [A] and area in the main view where they can be dropped [B]. This creates a new tab bundle nested under a previously created tab bundle [E].",0.08465032679738561,0.35402880517676766,0.9156793702973861,0.401829436489899,Figure,4.0
50,32,4,Paragraph,"[(119, 128), (128, 140), (140, 149), (149, 160), (160, 176), (176, 191), (191, 209), (209, 220), (220, 234), (234, 246), (246, 259), (259, 272), (272, 284), (284, 286)]","they wish to complete later, potentially scaffolding that placeholder with multiple subtasks (e.g., creating a task for a trip to Barcelona, along with subtasks for restaurants, shopping, sights, and trans- portation). This approach is typical of standard to-do lists, in which users queue up the tasks they need to work on and use the list as a reminder [6]. In this case a user can add a manual task to the system (Figure 1 G) , and give it a title in the same way as they would a to-do and can similarly serve as a reminder and be scheduled, prioritized, etc. (By default, Tabs.do also adds a circle to the left of each item modeled after typical to-do list systems, which the user can use to check off and complete the item, or change it into another item type as described later.) When the user decides to work on the task they can add any relevant tabs under the to-do item by dragging them into it.",0.08410784313725489,0.4090285353535353,0.48293781479738573,0.6002310606060606,,
51,32,4,Paragraph,"[(286, 298), (298, 311), (311, 323), (323, 337), (337, 346)]","Finally, a user can simply add a single tab (technically, a degenerate tab bundle containing only one tab) by dragging it out of the “Open tabs” pane, at which point it appears as an item representing that tab, including the title and the favicon (or tab icon) of that tab, but supporting the same functionality as any other tab bundle.",0.08465032679738561,0.6125310606060606,0.48047058969934653,0.6791994949494948,,
52,32,4,Paragraph,"[(346, 358), (358, 367), (367, 377), (377, 390), (390, 401), (401, 408)]","Below, we describe the ways in which the core tab bundle primitive can be combined with various task-based functionality to support users’ complex online task management needs. To ground this dis- cussion we first describe it in the context of an example user expe- rience, and then unpack details of the various system features and how they address the design goals above.",0.08465032679738561,0.6914994949494949,0.48293722875817013,0.7720063131313131,,
53,33,4,Section,"(408, 412)",4.2 Example User Experience,0.08465032679738561,0.7907468891414141,0.28846037908496736,0.8033259295454545,,
54,34,4,Paragraph,"[(412, 422), (422, 431), (431, 445), (445, 456), (456, 467)]","Consider a university student who has been considering taking a vacation somewhere in Europe. She casually searches on Google for “things to do in Spain’, and opens a few webpages in tabs. It quickly becomes apparent that she is most interested in two cities – Barcelona and Madrid. She starts to wonder about their lodging",0.08303758169934641,0.806320202020202,0.4804731151895426,0.8729886363636364,,
55,34,4,Paragraph,"[(467, 478), (478, 490), (490, 501), (501, 513), (513, 527), (527, 539), (539, 549), (549, 559), (559, 574)]","choices, so she creates two new searches for “Hotels in Barcelona” and “Hotels in Madrid” and opens a few hotel websites from each search results page. At this point, she has accumulated more than 15 tabs from the three searches and from opening more links into tabs as she read some of the webpages, and what started as a casual exploration to pass the time has quickly grown into a more intensive research session. She feels overwhelmed by her open tabs, and cannot easily switch focus between her tabs for researching hotels in the two cities and her tabs for researching things to do in Spain .",0.5191977124183007,0.4090285353535353,0.9170028705254905,0.5336946181818182,,
56,34,4,Paragraph,"[(574, 585), (585, 597), (597, 611), (611, 624), (624, 636), (636, 648), (648, 659), (659, 670), (670, 682), (682, 694), (694, 703), (703, 714), (714, 726), (726, 737), (737, 751), (751, 762), (762, 775), (775, 789), (789, 794)]","She opens Tabs.do and finds all her open tabs automatically grouped into three task bundle suggestions in the Open Tabs panel (Figure 1 B, D). To start a new workspace for them, she creates a new project in Tabs.do titled “Vacation in Spain.” To save her open tabs in an organized way, she drags each of the automatic tab groups and drops them into the Project View to create three task bundles (Figure 1 C). Tabs.do automatically assigned the search terms as titles of the three task bundles. To further organize her tasks, she creates an empty task bundle titled “Places to Stay” and nests her two hotel task bundles under it (Figure 1 C). She then creates other empty task bundles titled “Restaurants in Madrid” and “Restaurants in Barcelona” nesting them under “Places to Eat” via drag and drop (Figure 2) as reminders for what she needs to research next. To continue her research, she closes all her tabs for researching hotels with three clicks in the Open Tabs view to first select the two tab bundles for “Hotels in Barcelona” and “Hotels in Madrid” and use the “Close Selected Tabs” button to close them (Figure 1 E). Now all her open tabs are about things to do in Spain again, she switches her focus back her initial subtask.",0.5189918300653594,0.5454073232323232,0.9157296417254902,0.8057941919191919,,
57,34,4,Paragraph,"[(794, 805), (805, 818), (818, 833), (833, 847)]","As she continues to read from the webpages, she opens Tabs.do’s Popup Menu to save notes from the webpage she is reading (Figure 3 B). When she returns to her project in Tabs.do (Figure 1 C, F), she can see an overview of all the notes she took on the individual tabs. After",0.5190212418300654,0.8201573232323233,0.9156273778823529,0.8729886363636364,,
58,34,4,Paragraph,"[(847, 848)]",5,0.4973513071895425,0.8943739898989899,0.5026500277777778,0.9031792929292929,,
59,35,5,Header,"[(0, 8), (8, 15)]","UIST ’21, October 10–14, 2021, Virtual Event, USA Chang, Kim, Miller, Liu, Myers and Kittur",0.08465032679738561,0.0720265032828283,0.9153500186274508,0.0808318063131313,,
60,36,5,Caption,"[(15, 40), (40, 66), (66, 91), (91, 107)]","Fig. 3. User can also access Tabs.do while they process information on the current tab using the Popup View via the extension button and without switching to the full interface (Figure 1). [A] If the current tab was previously saved, a ""saved"" badge will appear whenever user switches to this tab. Previously saved notes [B] and attributes, such as project [C] and priorities [D] are also reflected. the popup view allows users quick access to their notes about the page, allowing them to accumulate notes as they read from the individual tabs.",0.08465032679738561,0.4681235021464646,0.48246458479738574,0.5662410526515151,Figure,6.0
61,37,5,Paragraph,"[(107, 122), (122, 134), (134, 146), (146, 156), (156, 167), (167, 179), (179, 190), (190, 203), (203, 214), (214, 224)]","a while, she notices in Tabs.do that there is a task bundle for a class assignment due today (Figure 1 H). She decides she should work on her assignment, so she closes all her tabs for Spain vacation research, feeling confident knowing that she can resume her research progress any time by reopening her task bundles into tabs from Tabs.do, and all her notes and scroll positions will be restored. Finally, she navigates to a Tabs.do project she had previously created for the class and reopens its task bundles back into open tabs (Figure 4 F), including presentation slides, her notes on Google Docs, and the link to the homework instructions to start working on her homework.",0.08465032679738561,0.5816232323232323,0.48207868130718967,0.7174785353535352,,
62,38,5,Section,"(224, 228)",4.3 [D1] Task-Centric Context-Switching,0.08465032679738561,0.7353984042929292,0.3701471875816994,0.7479774446969696,,
63,39,5,Paragraph,"[(228, 239), (239, 250), (250, 261), (261, 273), (273, 286), (286, 301), (301, 316), (316, 331), (331, 341)]","As reflected in the example above, users often manage their at- tention at the task level and need support when switching focus between sets of tabs supporting their different tasks and subtasks – for example, switching from one set of tabs about hotels in Barcelona to another set about hotels in Madrid . Tabs.do supports this by al- lowing users to group tabs and save them as a tab bundle. To do so, users can click and select a set of open tabs listed in the Open Tabs pane (Figure 1 B) and use drag and drop to save them into a default holding area, a project they had previously created (detailed below),",0.08413725490196078,0.7509717171717172,0.482947782901961,0.8729886363636364,,
64,40,5,Caption,"[(341, 363), (363, 391)]","Fig. 4. Tabs.do provides a set of affordances for prioritizing tab bundles. [A] Users can categorize tabs as References, To-dos, To-reads, Completed, or Deleted, which sorts it into different sections in their projects; [B] The edit button bring up an Edit View (identical to the Popup view in Figure 3)",0.5195343137254902,0.46423587588383836,0.9173485717254903,0.5120365071969697,Figure,7.0
65,41,5,Paragraph,"[(391, 405), (405, 406)]","where users can assign due dates to their tabs. [C] Marking tabs as the “Maybe/Someday”compressesthematthebottom[E]butarenotcompletelyoutofsightwithonerandomtabshowing.[D]Userscanalsoassigncolorcodedpriorities,whichsortstheirtaskswithinthesections.[F]Userscanopenatabbundlebackintoopentabs(independenttoprioritization).",0.5180245098039216,0.5145527950757576,0.9158978924019607,0.5749317092171717,,
66,41,5,Paragraph,"[(406, 416), (416, 430), (430, 444), (444, 456), (456, 469), (469, 481), (481, 493), (493, 506), (506, 516), (516, 526), (526, 529)]","or a new project. On creation, the system automatically generates a title suggestion for the tab bundle so it is easier to recognize in the future (e.g., Hotels in Barcelona ), and it can be edited by the users. After saving, users could use the close selected tabs button to close the set of tabs (Figure 1 E). Creating tab bundles in Tabs.do enables users pause and resume progress at the task level. To resume a previously closed task, users can reopen tabs under a bundle using button that shows up on hover (Figure 4 F), either in the current browser window or in a newly created browser window. Tabs.do automatically restores their scroll positions so users can more easily resume their progress.",0.5195343137254902,0.5899035353535353,0.9157278836078431,0.739594696969697,,
67,41,5,Paragraph,"[(529, 541), (541, 551), (551, 564), (564, 574), (574, 585), (585, 597), (597, 611), (611, 623), (623, 634)]","One key challenge here is the cost of sifting through open tabs to group all relevant tabs and naming them afterward, especially for users who keep a large number of tabs opened. To lower the interaction and cognitive costs of this process, Tabs.do uses machine learning to make tab grouping suggestions in the Open Tabs pane by showing a green border around the suggested name with a set of tabs (Figure 1 D). Users can save a suggested tab group using its title as the handle for dragging and dropping into the Project view (Figure 2 and Figure 1 C). Alternatively, before dragging, they can",0.51909477124183,0.7509717171717172,0.9158987726431373,0.8729886363636364,,
68,41,5,Paragraph,"[(634, 635)]",6,0.4973513071895425,0.8943739898989899,0.5026500277777778,0.9031792929292929,,
69,42,6,Header,"[(0, 5), (5, 13)]","Tabs.do: Task-Centric Browser Tab Management UIST ’21, October 10–14, 2021, Virtual Event, USA",0.08434150326797385,0.0720265032828283,0.9153518179738558,0.0808318063131313,,
70,43,6,Paragraph,"[(13, 26), (26, 39), (39, 48), (48, 60), (60, 72)]",click on the title to select tabs in the bundle suggestion which allows users further select or deselect tabs to fix any mistakes made by the machine learning model. The automatic task grouping lowers the interaction costs of creating tasks as well as giving users a better overview of their open tabs even before saving them (Figure 1 B).,0.08465032679738561,0.10063333333333331,0.48074104679738583,0.16730176767676774,,
71,43,6,Paragraph,"[(72, 81), (81, 93), (93, 104), (104, 114), (114, 125), (125, 134), (134, 145), (145, 157), (157, 165), (165, 175), (175, 182)]","To generate the task grouping predictions, we collected browsing history from four authors and labeled them to train a neural network model that can make predictions about which tabs belong to the same tasks. We used TensorFlowJS as our machine learning library [48], which allowed us to distribute the trained model with the extension to make task predictions inside users’ browsers. This design has the benefit of allowing Tabs.do to make predictions about users’ open tabs without having to transmit to a remote server their browsing history which may contain sensitive personal information. Detailed description of this dataset, the task prediction model, and its accuracy is described in Section 4.6.",0.08421078431372549,0.1781510101010101,0.48272478954248366,0.32784217171717167,,
72,44,6,Section,"(182, 187)",4.4 [D2] Task Mental Models,0.08465032679738561,0.34513199015151513,0.2904626663398693,0.3577110305555555,,
73,45,6,Paragraph,"[(187, 197), (197, 208), (208, 219), (219, 231), (231, 243), (243, 255), (255, 267), (267, 277), (277, 289), (289, 301), (301, 314), (314, 326), (326, 328)]","While tabs are typically instantiated as a linear, temporally ordered list, users’ task structures are often more complex. In our example user’s scenario above, a vacation to Spain had several subtasks in- cluding researching places to stay and places to eat, in both Madrid and Barcelona (Figure 1 C). To support this task structure, tab bun- dles can be nested within other tab bundles by dragging and drop- ping them (Figure 2), acting as subtasks that can be expanded and collapsed and given different priority levels, notes, or other task functions. Nesting can be done to arbitrary levels of depth; to ad- dress issues with real-estate and visual clutter at high levels of depth the system provides a “focus” button which fills the view at the se- lected level of depth with a breadcrumb allowing them to exit the focused view.",0.08394607843137254,0.36070530303030296,0.4829488030326796,0.538070707070707,,
74,45,6,Paragraph,"[(328, 337), (337, 348), (348, 358), (358, 370), (370, 381), (381, 394), (394, 405), (405, 417), (417, 428), (428, 440), (440, 454), (454, 465), (465, 478), (478, 493), (493, 503), (503, 514)]","Another challenge with task structure is supporting different types of projects and projects at different stages of progress. One common task type involves the long term collection, organization, and re- access of content, such as collecting content relevant to a field of scientific study, a kitchen remodel, a design mood board, a course being taught, or a term project for a course. To support such tasks, Tabs.do allows users to define tab bundles as long term projects, which have a privileged position in the Main Menu (Figure 1 A). Such projects are a familiar metaphor and correspond to the use of workspaces in the Workona or Toby tab manager, or to projects in to-do list tools such as Todoist. Unlike in such tools, we aim to address the challenge that even the number of long term projects can grow unwieldy and can go in and out of relevance over time; to support this we enable users to pin projects to the top of the list, similar to pinning messages in an email client. Although potentially a mixed metaphor, we found this to work well in practice.",0.08410784313725489,0.5489199494949495,0.48293781479738584,0.7677967171717172,,
75,45,6,Paragraph,"[(514, 523), (523, 536), (536, 549), (549, 560), (560, 572), (572, 584), (584, 595)]","However, the larger challenge in supporting various task structures are the many tasks in the long tail that are short term, ephemeral, or in the early stages, and which often outnumber the set of long term projects [8, 13, 29]. Users find projects and workspaces too heavy for such tasks [13], requiring too much effort to create and, more importantly, to get rid of or refactor; as well as “polluting” their important long term projects with a large number of short",0.08465032679738561,0.7786459595959596,0.48211589479738587,0.8729886363636364,,
76,45,6,Paragraph,"[(595, 606), (606, 618), (618, 631), (631, 643), (643, 653), (653, 663), (663, 674), (674, 686), (686, 696), (696, 709), (709, 715)]","term or less developed tasks. To address these tasks we introduce a holding tank which acts as the default view for participants’ tab bundles. The holding tank aims to make it easy for users to throw in tab bundles, single tabs, or even manual to-dos with no tabs attached without spending the cognitive effort to figure out how to structure and organize them and without polluting their curated project information space. Such tasks can act as reminders for the user to come back to them; can be easily removed by changing their status to “completed”, deleting them, or simply ignoring them as they drop below the fold; and can be refactored into larger tab bundles by dragging and dropping them.",0.5195343137254902,0.10063333333333331,0.9158977177725492,0.2503244949494949,,
77,45,6,Paragraph,"[(715, 723), (723, 734), (734, 746), (746, 757), (757, 771), (771, 783), (783, 795), (795, 808), (808, 819), (819, 831), (831, 842), (842, 854), (854, 866), (866, 878), (878, 890), (890, 902), (902, 913), (913, 924), (924, 934)]","Beyond creating structures, Tabs.do also provides two mechanisms for keeping track of users’ progress on their individual tabs. Firstly, users can save tabs into Tabs.do when they are reading from web- pages in their open tabs without switching into the main interface of Tabs.do. To do so, users can click on the extension button to see the Popup view of Tabs.do (Figure 3), allowing them to save the current tab and set detailed attributes for it, such as priority and due date (Figure 3 D). To help user maintain task context, the Popup view saves tabs into the most recently accessed project from the same browser window (Figure 3), but users can also select a different project or create a new project (which changes the project context for the browser window). In the Popup view, users can also change the title of the tab and take notes to externalize useful information they gathered from the current page and use Tabs.do as the external memory for their task. Whenever users open or switch to an open tab that was previously saved, a “saved” badge appears on the ex- tension button. Users can open the Popup view to access previously saved notes to remind them of their progress, and accumulate more information by editing the notes field in the Popup view.",0.5191683006535948,0.2639515151515151,0.9178327899607845,0.5243383838383838,,
