,index,page,type,intervals,text,x1,y1,x2,y2,block_type,block_id
0,1,0,Title,"[(0, 5)]",Tabs.do: Task-Centric Browser Tab Management,0.083890522875817,0.09769021439393942,0.6446568611111112,0.1194268305555555,,
1,2,0,Author,"[(5, 12), (12, 18), (18, 24), (24, 31), (31, 38), (38, 44)]","JOSEPH CHEE CHANG, Carnegie Mellon University, USA YONGSUNG KIM, Carnegie Mellon University, USA VICTOR MILLER, Carnegie Mellon University, USA MICHAEL XIEYANG LIU, Carnegie Mellon University, USA BRAD A. MYERS, Carnegie Mellon University, USA ANIKET KITTUR, Carnegie Mellon University, USA",0.08402450980392162,0.15388533131313137,0.5162098898692811,0.2916267454545456,,
2,3,0,Abstract,"[(44, 65), (65, 90), (90, 112), (112, 136), (136, 158), (158, 180), (180, 201), (201, 206)]","Despite the increasing complexity and scale of people’s online activities, browser interfaces have stayed largely the same since tabs were introduced in major browsers nearly 20 years ago. The gap between simple tab-based browser interfaces and the complexity of users’ tasks can lead to serious ad- verse effects – commonly referred to as “tab overload.” This paper introduces a Chrome extension called Tabs.do, which explores bringing a task-centric approach to the browser, helping users to group their tabs into tasks and then organize, prioritize, and switch between those tasks fluidly. To lower the cost of importing, Tabs.do uses machine learning to make intelligent suggestions for grouping users’ open tabs into task bundles by exploiting behavioral and semantic features. We conducted a field deployment study where participants used Tabs.do with their real-life tasks in the wild, and showed that Tabs.do can decrease tab clutter, enabled users to create rich task structures with lightweight interactions, and allowed participants to context-switch among tasks more efficiently.",0.08416830065359478,0.29839002525252517,0.48266635074395414,0.484560606060606,,
3,4,0,Paragraph,"[(206, 216), (216, 225)]",CCS Concepts: • Information systems → Browsers ; • Human-centered computing → Graphical user interfaces ; Web-based interaction .,0.0846503267973856,0.5025907828282828,0.4804660433006536,0.5275883881313131,,
4,5,0,Keywords,"[(225, 235), (235, 243)]","Additional Key Words and Phrases: browser tab management, task manage- ment, to-dos, bookmarking, sensemaking, exploratory search, tab overload",0.08419444444444445,0.5445213383838384,0.4826652198973853,0.5684217171717172,,
5,6,0,Paragraph,"[(243, 246)]",ACM Reference Format:,0.08416830065359478,0.5887777690656566,0.22631477369281044,0.5988410266414141,,
6,6,0,Paragraph,"[(246, 267), (267, 278), (278, 296)]","Joseph Chee Chang, Yongsung Kim, Victor Miller, Michael Xieyang Liu, Brad A. Myers, and Aniket Kittur. 2021. Tabs.do: Task-Centric Browser Tab Management. In The 34th Annual ACM Symposium on User Interface Software and Technology (UIST ’21), October 10–14, 2021, Virtual Event, USA. ACM, New York, NY, USA, 14 pages. https://doi.org/10.1145/3472749.3474777",0.08444117647058823,0.6072334595959596,0.4819028288137254,0.6676136363636364,,
7,7,0,Section,"(296, 298)",1 INTRODUCTION,0.08465032679738561,0.6959388083333332,0.22736619967320262,0.7085178487373738,,
8,8,0,Paragraph,"[(298, 308), (308, 317), (317, 327), (327, 339)]","Despite our browsers being responsible for how we accomplish an increasingly significant proportion of the tasks in our professional and personal lives [13, 20], browser interfaces for managing those tasks have changed little in the past 20 years since tabbed browsing",0.08465032679738561,0.7115108585858586,0.48047155666405245,0.7643434343434343,,
9,8,0,Paragraph,"[(339, 370), (370, 399), (399, 406), (406, 421)]","Permission to make digital or hard copies of part or all of this work for personal or classroom use is granted without fee provided that copies are not made or distributed for profit or commercial advantage and that copies bear this notice and the full citation on the first page. Copyrights for third-party components of this work must be honored. For all other uses, contact the owner/author(s). UIST ’21, October 10–14, 2021, Virtual Event, USA © 2021 Copyright held by the owner/author(s).",0.08386437908496731,0.7816643939393938,0.48222484158169954,0.8528623737373737,,
10,9,0,Footer,"[(421, 425)]",ACM ISBN 978-1-4503-8635-7/21/10. https://doi.org/10.1145/3472749.3474777,0.08425163398692809,0.854120202020202,0.26952439738562095,0.8729886363636362,,
11,10,0,Paragraph,"[(425, 435), (435, 447), (447, 458), (458, 469), (469, 480), (480, 493), (493, 496)]","was popularized [13]. Today’s internet users interact with a dramat- ically different web than that of two decades ago which has grown tremendously in size and complexity [40]. The amount of time the average internet user spends online has also grown: when tabs were introduced to the Mozilla browser in 2002, people spent on average 7 hours online per week; 1 that number is now approaching 7 hours per day. 2",0.5189918300653594,0.29713207070707065,0.9178230432418303,0.3914747474747475,,
12,10,0,Paragraph,"[(496, 507), (507, 516), (516, 527), (527, 537), (537, 546), (546, 558), (558, 571), (571, 582), (582, 592), (592, 604), (604, 615), (615, 625), (625, 638), (638, 651), (651, 661), (661, 673), (673, 686)]","The mismatch between the growing size and usage of the internet with relatively static web browser interfaces suggests the possibility that the original tabbed browsing paradigm may no longer be suffi- cient for today’s complex online tasks. There is mounting evidence for this, including dozens of popular press articles characterizing issues such as “Tab Overload” or “Tab Hoarding” [26–28, 41, 44, 45] as well the rise of bookmarking tools, such as Pocket (over 1 billion pieces of content saved) and Pinterest (over 450 million users), and tab management tools such as OneTab or SessionBuddy (over 1 million users each [21, 23]) aiming to reduce the number of open tabs users have open. Some browsers such as Chrome and Firefox have introduced or are experimenting with enabling users to com- bine several tabs into a single group to help with tab overload. The general approach taken by the above tools is to save tabs and close them, either individually, as groups, or as whole sessions, putting them out of sight, enabling users to free their attention and reduce clutter while being able to (in theory, at least) reload those tabs later.",0.5189918300653594,0.40258282828282826,0.9178330536784314,0.6352954545454546,,
13,10,0,Paragraph,"[(686, 693), (693, 704), (704, 715), (715, 724), (724, 736), (736, 746), (746, 755), (755, 766), (766, 777), (777, 788), (788, 800), (800, 813), (813, 822)]","However, a recent study interviewing information professionals and surveying a wider audience, many of whom tried using solu- tions such as the above, points to more fundamental problems with tabbed browsing that raises concerns about the above approaches [13]. Specifically, [13] noted that browser tabs are often used for a variety of task management functions that they were not necessarily designed for, ranging from reminding to prioritization, but function suboptimally for doing so. For example, users keep tabs open so they can resume progress on their tasks but cannot easily switch focus between sets of tabs for their different tasks; as reminders that quickly lose reminding value as they pile up; as reading lists of items that are never actually read and result in clutter; and as manifestations of their mental models that are artificially forced",0.5191683006535948,0.6464035353535353,0.9178218017254904,0.8237676767676767,,
14,11,0,Footnote,"[(822, 824), (824, 826), (826, 827)]",1 https://theharrispoll.com/wp-content/uploads/2017/12/HI-Harris-Poll-Time-Spent-Online-2009-12-23.pdf 2 https://datareportal.com/library 1,0.49721895424836604,0.8417354797979798,0.9163065683575163,0.9031792929292929,,
15,12,1,Header,"[(0, 8), (8, 15)]","UIST ’21, October 10–14, 2021, Virtual Event, USA Chang, Kim, Miller, Liu, Myers and Kittur",0.08465032679738561,0.0720265032828283,0.9153500186274508,0.0808318063131313,,
16,13,1,Caption,"[(15, 69), (69, 126), (126, 162)]","Fig. 1. The main interface of Tabs.do that replaces the new tab page after installation. [A] The Main Menu for switching among projects and views that filter tasks with different priorities across projects. For example, [H] the Today View lists tabs that are due today. [B] The Open Tabs View allows users to import their tabs into Tabs.do via dragging and dropping into project labels in [A] or the current project [C]. [C] The Project View contains a list of tabs and tab bundles saved by the user. [D] Open tabs are automatically grouped by a deep learning model so that users can more easily import them as tab bundles and close them by clicking [E] to remove tab clutter. [F] Users can create hierarchical structures for their saved tabs to reflect their mental models; or [G] create a manual task similar to general task management applications.",0.08465032679738561,0.5397901688131314,0.9155858648758168,0.612748628409091,Figure,2.0
17,14,1,Paragraph,"[(162, 174), (174, 184), (184, 196), (196, 201)]","into a simple, temporal and linear list [13]. This suggests a divide between current browser designs that treat browser tabs as stacks of individual webpages and users who see bundles of tabs as their current and future tasks [13].",0.08465032679738561,0.6199477272727272,0.4807417207424835,0.672780303030303,,
18,14,1,Paragraph,"[(201, 212), (212, 224), (224, 233), (233, 244), (244, 254), (254, 267), (267, 277), (277, 289), (289, 298), (298, 310), (310, 322), (322, 332), (332, 342)]","As a result, many attempts to address issues with tabbed browsing by addressing the surface level problem of closing tabs run the risk of conflicting with tabs’ implicit task management functions. For example, bookmarking and closing tabs results in a lack of remind- ing and resurfacing functionality that users describe as leading to a “black hole” effect in which closed tabs are unlikely to ever be encountered again [13]. Other issues result from approaches such as tab groups, which may serve as a temporary stopgap but can result in overload as their numbers grow. More sophisticated approaches allow users to create workspaces of tabs that they can suspend and resume, such as in the Toby or Workona tab managers [22, 24]. However, while these workspaces can work well for relatively static tasks, users noted the challenges of manually creating and managing",0.08413725490196078,0.6956232323232324,0.48294251776209157,0.8729886363636364,,
19,14,1,Paragraph,"[(342, 351), (351, 360), (360, 371), (371, 382), (382, 393)]","static workspaces for complex online tasks that involved collecting and organizing information that were constantly changing in prior- ity or relevance. They also noted the challenges with evolving tasks that were too small, ephemeral, or undeveloped to merit their own workspace, but were still important to manage and keep track of.",0.5189918300653594,0.6199477272727272,0.9178336397176472,0.6866174242424241,,
20,14,1,Paragraph,"[(393, 405), (405, 415), (415, 424), (424, 433), (433, 443), (443, 456), (456, 467), (467, 478), (478, 491), (491, 501), (501, 511), (511, 519)]","In this paper we introduce and explore the idea of a task-centric approach to managing browser tabs that bridges the gap between managing individual browser tabs and managing users’ online tasks and subtasks. Task-centric approaches have been shown to work well for domains such as file systems, application windows and email [2, 3, 7, 31, 54], suggesting there may be a profitable design space to be explored for browsing as well. However, while browsing, users are often exploring and sampling items from a nearly infinite space for a myriad of purposes, leading to tasks that are often more ad hoc, uncertain, and ephemeral than the traditional projects and desktop applications that prior systems have targeted [13, 38]. To investigate these challenges, we instantiate a task-centric tabbed",0.5189918300653594,0.7094603535353535,0.9169626682352944,0.8729886363636364,,
21,14,1,Paragraph,"[(519, 520)]",2,0.4973513071895425,0.8943739898989899,0.5026500277777778,0.9031792929292929,,
22,15,2,Header,"[(0, 5), (5, 13)]","Tabs.do: Task-Centric Browser Tab Management UIST ’21, October 10–14, 2021, Virtual Event, USA",0.08434150326797385,0.0720265032828283,0.9153518179738558,0.0808318063131313,,
23,16,2,Paragraph,"[(13, 22), (22, 33), (33, 43), (43, 53), (53, 60), (60, 72), (72, 84), (84, 93), (93, 103), (103, 114), (114, 125), (125, 135), (135, 145), (145, 156)]","browsing approach in a prototype browser extension, Tabs.do, and evaluate its effectiveness in a field deployment (Figure 1). The basic intuition behind Tabs.do is that tabs can be “bundled” together and treated as tasks, with the system providing task management functionality such as reminding, prioritization, complex structure, task switching, and support for tasks both early and late in maturity. To further lower the friction of importing open tabs into the system, Tabs.do uses machine learning to make predictions about which open tabs correspond to the same tasks by exploiting behavioral and semantic features, allowing users to drag and drop groups of tabs into the system to create pre-labeled, bundled tasks. To protect users’ privacy, the task prediction model runs locally inside users’ browsers, so that Tabs.do does not transmit information about users’ open tabs before they explicitly save their tabs into our system.",0.08421078431372549,0.10063333333333331,0.4827247895424837,0.291834595959596,,
24,16,2,Paragraph,"[(156, 167), (167, 177), (177, 188), (188, 198), (198, 208), (208, 220), (220, 229)]","After several months of internal usage and iteration by the research team, we conducted a field deployment study with participants using Tabs.do with their real-life tasks and tabs. Based on interviews and log data, we found evidence that Tabs.do allowed participants to create rich task structures from their tabs with lowered interaction costs, to keep fewer tabs and be more focused on their important tasks but also context-switch among tasks efficiently when needed.",0.08413725490196078,0.30142626262626265,0.4827210828444444,0.395770202020202,,
25,16,2,Paragraph,"[(229, 235)]",The contributions of this paper include:,0.08421078431372549,0.40536060606060603,0.3213662039215687,0.4166818181818182,,
26,17,2,List,"[(235, 246), (246, 257), (257, 268), (268, 271), (271, 280), (280, 288), (288, 298)]","(1) Exploring the idea of a task-centric approach to tabbed web browsing that aims to support the ad hoc and exploratory as- pect of web browsing in addition to more stable collections of documents and resources. (2) A prototype browser extension, Tabs.do, instantiating this ap- proach through supporting a set of task-management affor- dances that help users manage a variety of browsing tasks.",0.08619771241830064,0.4262734848484848,0.4829458139607845,0.5276931818181818,,
27,18,2,Paragraph,"[(298, 307), (307, 317), (317, 327), (327, 335), (335, 344), (344, 347), (347, 348), (348, 349)]","Our system enables users to create complex task structures by grouping and nesting tabs, allows them to fluidly suspend and relaunch tasks to reduce tab clutter, reduces friction through automatic task suggestions, and helps users manage attention through task prioritization, scheduling, and a variety of task types and statuses. (3) AfielddeploymentstudywithparticipantsshowingthatTabs.Dochangedthewaytheyinteractedwiththeirbrowsertabsontheirownreal-worldtasks,helpingthemreducetabclutterandincreasefocus.",0.08619771241830064,0.5302090909090909,0.48281102494117656,0.6731388888888888,,
28,19,2,Section,"(349, 356)",2 RELATED WORK 2.1 Tabbed Web Browsing,0.08465032679738561,0.6891711315656566,0.26908865686274513,0.7203044648989899,,
29,20,2,Paragraph,"[(356, 365), (365, 377), (377, 388), (388, 399), (399, 410), (410, 422), (422, 430), (430, 440), (440, 449), (449, 461), (461, 474)]","Tabbed web browsing behavior was extensively studied when major browsers started to support tabbed interfaces [11, 20, 51, 56, 57]. This early work focused on the gradual user adoption of tabbed brows- ing and its benefits over using only browser windows. For example, researchers observed that the use of the back button decreased from 40% in the mid-90s to 7% in the mid-2010s when browsers that supported tabbed browsing reached 50% combined market share [55]. This suggested users preferred opening links using tabs and switching among them instead of loading multiple webpages us- ing the same tab [33]. More closely related to our work, Huang et al. [34] estimated that 60% of users’ browser tabs are related to",0.08421078431372549,0.7232974747474747,0.48294436378562094,0.8729886363636364,,
30,20,2,Paragraph,"[(474, 488), (488, 499), (499, 510), (510, 520), (520, 530), (530, 542), (542, 553), (553, 564), (564, 574), (574, 583), (583, 594), (594, 604), (604, 615), (615, 625), (625, 636), (636, 647), (647, 660), (660, 670), (670, 682), (682, 692), (692, 705), (705, 715), (715, 728), (728, 737), (737, 744)]","at least one other tab of the same task. Our work builds on this observation that users often open multiple tabs to support the same task, and provides mechanisms for users to group them together as task bundles. More recently, Bento Browser [29] explored a search- centric mobile browser that scaffolds users search tasks by treating all search results as opened or unopened tabs. In the current work, we also exploit users’ search activities to scaffold their task struc- tures. However, instead of forcing tabs opened from a search results to be grouped together, Tabs.do uses a machine learning model that considers search activities and other behavioral and semantic features at the same time to produce tab grouping suggestions. This allows Tabs.do to produce grouping suggestions for tabs not opened from search results, and allows users to make adjustments to the grouping suggestions to better fit their mental models and correct mistakes made by the model. Most directly related to this current work is a recent interview and survey study that investigated tab management issues users face today [13]. At a high level, one of the main observations was that users need support managing their tabs based on the tasks they were conducting [13]. In the current work, we explore taking a task-centric approach to tab management by allowing users to group their tabs and save them into the system as tab bundles. The system, in turn, provides affordances to manage them as tasks. For example, users can also group their tabs into tasks and subtasks to better reflect their mental models, context-switch between their tasks or subtasks more efficiently.",0.5189918300653594,0.10063333333333331,0.9178322460653595,0.44404166666666667,,
31,21,2,Section,"(744, 747)",2.2 Task Management,0.5195343137254902,0.500169868939394,0.678235927124183,0.5127489093434343,,
32,22,2,Paragraph,"[(747, 758), (758, 767), (767, 776), (776, 787), (787, 798), (798, 807), (807, 818), (818, 827), (827, 836), (836, 849), (849, 858), (858, 868), (868, 878), (878, 888), (888, 898), (898, 909), (909, 921), (921, 932), (932, 942), (942, 951), (951, 960), (960, 969), (969, 980), (980, 990), (990, 1001), (1001, 1003)]","The idea of assisting users in better managing their attention by grouping related applications, files, and contacts by task contexts has been extensively explored in the activity-based computing liter- ature [4, 5]. Early systems focused on building workspaces for the desktop environment [2, 3, 31, 54], for example allowing users to group application windows by different virtual desktops and switch among them [31], organize files and application shortcuts in a 3D desktop environment [3], or create integrated workspaces by group- ing application windows, files, and contacts for knowledge work [54]. In the current work, we build on ideas from prior research in activity-based computing, but focus on the important yet relatively unexplored context of managing browser tabs and its unique re- search challenges. Specifically, tasks in the browser are often more ad hoc, uncertain, and ephemeral than the traditional projects and desktop applications that prior systems have targeted [13, 38], re- flecting that users are exploring and sampling items from a nearly infinite space for a myriad of purposes in addition to keeping track of a finite set of their own documents. This fundamental difference introduces challenges such as allowing for fluid task structures that can support externalizing small tasks of uncertain importance that can later become full-fledged projects once explored more deeply [38], prioritizing and reminding users of their previously suspended tasks to avoid a black hole effect often associated with bookmark- ing [13], and de-prioritizing low importance tasks to avoid clutter while coping with users’ aspiration to collect and process too much information [13].",0.5189918300653594,0.5157431818181818,0.9178328331294117,0.8729886363636364,,
33,22,2,Paragraph,"[(1003, 1004)]",3,0.4973513071895424,0.8943739898989899,0.5026500277777777,0.9031792929292929,,
34,23,3,Header,"[(0, 8), (8, 15)]","UIST ’21, October 10–14, 2021, Virtual Event, USA Chang, Kim, Miller, Liu, Myers and Kittur",0.08465032679738561,0.0720265032828283,0.9153500186274508,0.0808318063131313,,
35,24,3,Paragraph,"[(15, 27), (27, 37), (37, 46), (46, 57), (57, 66), (66, 77), (77, 86), (86, 93), (93, 103), (103, 117), (117, 126), (126, 137), (137, 147), (147, 158), (158, 168), (168, 177), (177, 188), (188, 196), (196, 207), (207, 215)]","Closely related to our work, another thread of research in the early 2000s explored how emails often represented users’ tasks and ex- plored how providing task management affordances in email clients can benefit users [7] – for example, prioritizing and scheduling dead- lines for individual emails or grouping multiple messages, threads, and attachments into larger tasks. Since email tasks are by nature collaborative (i.e., receiving and delegating work with others), many prior systems focused on deadline management, communication, and coordination with others in business settings. In this current work, we also assume that tabs are often seen as tasks by users in both personal and professional scenarios and explore a task-centric approach to managing them. While there is also prior work that looked at the real-time collaboration of web browsing (i.e., collab- orative search), in this work, we focus on managing browser tabs in a single-user scenario and see collaboration as potential future work. Fundamentally, as the browser has increasingly become the primary “habitat” [7, 58] of our digital tasks as desktop applications and communication channels continue to migrate to web-based platforms [20], it is crucial for research to understand better ways to support task management in the browser environment.",0.08410784313725489,0.10063333333333331,0.482940696366013,0.37485732323232324,,
36,25,3,Section,"(215, 220)",3 DESIGN GOALS AND MOTIVATIONS,0.08465032679738561,0.39492491944444447,0.3646124098039216,0.4075039598484848,,
37,26,3,Paragraph,"[(220, 232), (232, 243), (243, 253), (253, 262), (262, 272), (272, 283), (283, 293), (293, 304), (304, 314), (314, 324), (324, 335), (335, 340)]","When developing our design goals, we look to a recent interview and survey study on modern tab browsing behavior that focused on the issues that users face when managing their online activities using browser tabs [13]. The study provided deep qualitative insights based on interviewing ten researchers four times each over two weeks to sample their open tabs on their work computers, combined with survey data from another 103 participants. That study outlined a set of issues preventing users from closing their tabs, causing serious adverse effects, and developed a set of design implications for future browser interfaces. Here, we summarize three core issues and implications from this prior work [13] that were the primary motivations when designing our system:",0.08394607843137254,0.4104982323232323,0.48084046682352943,0.5740252525252525,,
38,26,3,Paragraph,"[(340, 350), (350, 361), (361, 371), (371, 381), (381, 392), (392, 400), (400, 407), (407, 417), (417, 428), (428, 431)]","Firstly, [13] found participants often saw browser tabs as external mental models of their online tasks, but the simple linear structure of tabs often insufficient for capturing their complex task structures with tasks, subtasks, and notes from reading the webpages. This led users to resort to solutions incurring high interaction and com- puting costs; for example, some participants simulated hierarchies using multiple browser windows, multiple browser applications, or multiple computers. Others used external tools such as word processors or spreadsheets to keep track of their tasks by copying and pasting URLs.",0.08410784313725489,0.5876535353535353,0.4829429426405229,0.7235075757575758,,
