,index,page,type,intervals,text,x1,y1,x2,y2,block_type,block_id
114,69,9,Paragraph,"[(430, 448), (448, 459), (459, 470), (470, 482), (482, 492), (492, 502), (502, 513), (513, 526), (526, 540), (540, 549), (549, 559), (559, 566)]","5.1.1 [D1] Task-Centric Context-Switching . Tabs.do enabled users to manage their attention at the task-level by introducing our basic primitive of tab bundles that groups sets of tabs supporting the same task together. Once created, tab bundles allowed users to “relaunch” a task by reopening tabs in the bundles. Log data showed that our participants were actively using our tab bundle primitive. For example, on average, each participants saved 50.8 tasks (SD=26.2) to Tabs.do and nested them 45.5 times (SD=26.2). This included both dragging a group of tabs from the Open Tab view (Figure 2) to create a tab bundle, as well as using drag and drop to create bundles from previously saved tabs. In the interviews, participants were enthusiastic about the ability to create tab bundles, especially when they first discovered the automatic bundle suggestions:",0.08299509803921569,0.46567752525252526,0.48272684067973864,0.6430429292929293,,
115,69,9,Paragraph,"[(566, 574), (574, 584), (584, 597), (597, 608), (608, 619), (619, 624)]","“Having subprojects [task bundles] and projects is really helpful, because that’s kind of what my workflow looks like. It’s like, I have these four tabs that are related to this new post I’m writing and these [other] four tabs are related to analytics, and like being able to organize them, I think that’s a big benefit.” – P3",0.1082549019607843,0.6530222222222223,0.459120389647059,0.7335290404040404,,
116,69,9,Paragraph,"[(624, 634), (634, 647), (647, 659), (659, 670), (670, 681)]","“I saw when it automatically grouped them before I even did anything. So that was so helpful. I was able to just make them into a task, like a big bundle... and then from there just close them out completely and know that I could come back to it. So that was really, really helpful.” – P6",0.1082549019607843,0.7435083333333333,0.45686853396078453,0.8101767676767676,,
117,69,9,Paragraph,"[(681, 689), (689, 699), (699, 709), (709, 723)]","Many participants also frequently reopened individual tabs from Tabs.do, averaging 27.3 reopened tabs (Table 1). This suggests that users consider reopening from Tabs.do to be more efficient compared to 1) keeping and switching to a set of tabs; or 2) re-tracing their",0.08421078431372549,0.8201573232323233,0.48074104679738583,0.8729886363636364,,
118,69,9,Paragraph,"[(723, 736), (736, 749), (749, 758), (758, 768), (768, 778), (778, 785), (785, 792), (792, 802), (802, 811), (811, 822), (822, 836), (836, 837)]","steps for opening them in the first place (such as using same query on Google, as reported in [1, 52]). On average, we found more tabs were opened from “relaunching” tasks using tab bundles (M=17.5; SD=28.2) than from clicking on and opening individual tabs (M=9.8; SD=12.1), although the difference was not significant under a paired T-Test (t(9)=-1.965,p=0.08). Closer examination suggests a bimodal distribution with some participants strongly preferring reopening sets of tabs using bundles while others preferring opening individual tabs. During the interviews, participants described how the ability to reopen sets of tabs from bundles allowed them to context-switch at the task level and remind them of all the subtasks they needed to completed:",0.5189918300653594,0.46567752525252526,0.9163883498039215,0.6292058080808081,,
119,69,9,Paragraph,"[(837, 850), (850, 861), (861, 874), (874, 888), (888, 895)]","“I was able to kind of switch to another task, and then close all those tabs [referring to the task she switched away from]. So starting again on a task I was working on is pretty easy... To open them all at once, kind of also remind me of all the steps I had to do.” – P1",0.5426993464052288,0.6437974747474747,0.8940043765751637,0.7104671717171718,,
120,69,9,Paragraph,"[(895, 907), (907, 919), (919, 929), (929, 938), (938, 947), (947, 959), (959, 964)]","“I work in batches, for example, in the morning, I come to the inbox [a project]. At night, 10:30, I come back to this [another project]. Somewhere between 5pm to 8pm, I go to Learning [another project] and open Kindle or Blinkist or Audible [referring to reopening tabs]. So according to what time of the day it is, it directly corresponds to what project I’m using. ” – P4",0.542625816993464,0.7250588383838383,0.892021439633987,0.8194015151515152,,
121,69,9,Paragraph,"[(964, 974), (974, 983), (983, 985), (985, 986)]",The ability to “relaunch” tasks was also commonly mentioned with time-saving and lowered interaction costs when compared to not using Tabs.do: 10,0.49457026143790844,0.8339931818181818,0.9153554849882355,0.9031792929292929,,
122,70,10,Header,"[(0, 5), (5, 13)]","Tabs.do: Task-Centric Browser Tab Management UIST ’21, October 10–14, 2021, Virtual Event, USA",0.08434150326797385,0.0720265032828283,0.9153518179738558,0.0808318063131313,,
123,71,10,Paragraph,"[(13, 23), (23, 35), (35, 44), (44, 56), (56, 69), (69, 73)]","“So per day, it’s probably saving me about anywhere from 30 to 45 minutes... just because that’s the time that I would spend like searching through all of my assignments, and then opening them up and then trying to find each of the readings that I have to do separately and then open up in a separate tab” – P6.",0.1082549019607843,0.10063333333333331,0.4568685339607843,0.18113888888888888,,
124,71,10,Paragraph,"[(73, 84), (84, 95), (95, 102), (102, 111), (111, 122), (122, 130), (130, 141), (141, 152), (152, 158)]","One significant challenge brought up by prior work on tab overload is that users have trouble closing tabs because they serve several task-centric functions, ranging from reminding to externalizing their working memory, resulting in clutter that, ironically, reduces the effectiveness of those task functions [13]. We instead found our participants’ expressing confidence closing tabs that they originally felt strongly attached to as a result of using Tabs.do, suggesting that our task-centric approach can address some of the tab issues brought up in prior work [13].",0.08465032679738561,0.19057272727272723,0.48084389667973865,0.3125909090909091,,
125,71,10,Paragraph,"[(158, 171), (171, 182), (182, 193), (193, 203), (203, 215), (215, 224), (224, 235), (235, 237)]","“So one big thing is I used to have two windows open all day. One with personal stuff, and one with work stuff. Now I don’t have the personal one open anymore. I basically used the tab manager to completely manage personal stuff that I wanted to get back to... So it prevented me from having two windows opening Chrome, which was the biggest gain; I didn’t do that this whole week since I started using Tabs.do.” – P3",0.1066421568627451,0.32202474747474746,0.4585173552941175,0.43020454545454545,,
126,71,10,Paragraph,"[(237, 250), (250, 262), (262, 263)]","“Probably being able to close a bunch of tabs I had open for, like, days. Just because I didn’t want to lose those tabs.” – P1",0.1082549019607843,0.4396396464646464,0.4584742814117649,0.47863383838383833,,
127,71,10,Paragraph,"[(263, 279), (279, 292), (292, 303), (303, 314), (314, 324), (324, 334), (334, 345), (345, 351)]","5.1.2 [D2]TaskMentalModels . Tabs.dosupportscapturingusers’ task mental models by allowing them to create a hierarchy of tasks with tab bundles as well as saving them into larger projects. Based on log data, each participant created an average of 4.0 projects (SD=3.0) and were actively creating nested tasks and subtasks from their tabs (an average of 45.4 times; SD=25.4). In the interviews, participants described how creating rich structures in Tabs.do allowed them to work in a more organized manner when compared to using the linear tab list of current browsers:",0.08410784313725489,0.48806893939393936,0.49177705171241837,0.6100858585858586,,
128,71,10,Paragraph,"[(351, 362), (362, 373), (373, 384)]","“I would say that before the Tab Manager [Tabs.do], I didn’t really have any structure or sense of priority of my tabs. They were just all just a mess. You know?” – P6",0.10781535947712419,0.6195196969696969,0.45911013396078443,0.6585151515151515,,
129,71,10,Paragraph,"[(384, 394), (394, 404), (404, 415), (415, 427), (427, 431)]","Interestingly, P6 further pointed to how the automatic tab grouping feature allowed her to have more situational awareness with her open tabs even before saving them, allowing her to find important tasks that she should focus on and encouraged her to create task bundles from the suggestions:",0.08465032679738561,0.6679502525252524,0.4808456547973859,0.7346186868686868,,
130,71,10,Paragraph,"[(431, 441), (441, 453), (453, 463), (463, 475), (475, 485), (485, 495), (495, 499)]","“The automatic grouping is everything to me. It kind of puts me in the mindset that those things are related to each other, and that they are somewhat important. Even now, I’m getting the urge to group these [saving a tab group into the holding tank], because this is all related to my JavaScript homework... so it just kind of changed my relationship with my tabs.” – P6",0.1082549019607843,0.744053787878788,0.4568685339607844,0.8383964646464647,,
131,71,10,Paragraph,"[(499, 510), (510, 520)]","These suggested that Tabs.do has a low upfront cost for participants to start benefiting from the system. Specifically, before saving tabs",0.08421078431372549,0.8478303030303029,0.48047155666405233,0.8729886363636364,,
132,71,10,Paragraph,"[(520, 531), (531, 539), (539, 550), (550, 559), (559, 564)]","into the system, the automatic task groupings can provide a better overview that promotes situational awareness than the built-in tab UI; and that even saving one tab bundle allowed participants to immediately close them confidently, knowing that they could relaunch their tabs when needed.",0.5195343137254902,0.10063333333333331,0.9156226602666669,0.16730176767676774,,
133,71,10,Paragraph,"[(564, 573), (573, 584), (584, 594), (594, 607), (607, 612)]","Participants also suggested potential features that would allow them to further benefit from the task bundling feature. For example, P1 pointed to a tighter integration between her task structures and the current tab by showing other tabs from the same tab bundle or project in the Popup View:",0.5195343137254902,0.18134797979797984,0.9156909631372551,0.2480176767676767,,
134,71,10,Paragraph,"[(612, 623), (623, 635), (635, 643)]",“You could have the extension button be able to open up related tabs [to the current tab] Like tabs that are in the same project or subtask [tab bundle].” – P1,0.543138888888889,0.2620638888888888,0.8917525208888892,0.3010593434343434,,
135,71,10,Paragraph,"[(643, 656), (656, 668), (668, 679), (679, 692), (692, 702), (702, 712), (712, 723), (723, 733), (733, 745), (745, 754), (754, 765), (765, 775), (775, 777)]","Tabs.do also allowed users to take notes in the Popup view (Figure 3) as they read from their individual tabs to use as external memory. Log data showed moderate use of the Popup view, accounting for an average of 35% of users’ total sessions with Tabs.do, and 13% of all tabs saved on average. However, participants only edited notes 5.6 times (SD=4.5). Prior work in general task management showed that people tend to spent minimal effort when naming their tasks, often with short description enough to provide salient cues. This offers a potential explanation to the lower usage of note editing in Tabs.do, suggesting participants primarily used Tabs.do as a task management tool instead of a note-taking tool in its current state, in contrast to the findings of other lightweight browser note-taking tools [53].",0.51909477124183,0.31510681818181807,0.917609289254902,0.49247095959595955,,
136,71,10,Paragraph,"[(777, 788), (788, 798), (798, 809), (809, 818), (818, 832), (832, 844), (844, 855), (855, 865), (865, 877), (877, 886), (886, 899), (899, 906)]","5.1.3 [D3] Prioritization . Similar to prior work on general task management [30], we also found that our participants used varying strategies to prioritize their tasks in Tabs.do. Log data showed some participants who rarely used the prioritization features such as status, priority level, and due date (P2, P7, P9 in Table 1) as well as participants who used them extensively (i.e., P3, P4, P5, P8 in Table 1). There were also differences in how participants used the prioritization features. For example, P3 and P4 mostly marked tabs with statuses such as references and to-reads in order to pull them out into different sections, whereas P5 most frequently scheduled due dates for their tabs, and P8 used a combination of statuses and marking tabs as Maybe/Someday to de-prioritize them.",0.5189918300653594,0.5065184343434344,0.9157285058718956,0.6726958808080808,,
137,71,10,Paragraph,"[(906, 915), (915, 925), (925, 935), (935, 945), (945, 956), (956, 964)]","Upon further investigation during the interviews, it turned out that some participants who did not extensively use the built-in prioritization features did end up prioritizing their tasks in Tabs.do, but used more ad-hoc methods. Most commonly, participants used a combination of open tabs, the Holding Tank, and Projects to triage their tasks from lower priority to higher priority:",0.5195343137254902,0.6840929292929293,0.9169557529725489,0.7645984848484849,,
138,71,10,Paragraph,"[(964, 975), (975, 988), (988, 998), (998, 1010), (1010, 1020), (1020, 1030), (1030, 1040)]","“One-off research things... I don’t think I would create a task for it... Like looking for recipes, I opened a lot of tabs, but then went through most of them and closed them within like 30 seconds or a minute each... And then I have the holding tank, which is like... just for one-off things that didn’t belong in a project and were temporary, but longer than I guess, a minute or five minutes.” - P1",0.543138888888889,0.7786459595959596,0.8921234837124185,0.8729886363636364,,
139,71,10,Paragraph,"[(1040, 1041)]",11,0.49457026143790855,0.8943739898989899,0.5051677026143792,0.9031792929292929,,
140,72,11,Header,"[(0, 8), (8, 15)]","UIST ’21, October 10–14, 2021, Virtual Event, USA Chang, Kim, Miller, Liu, Myers and Kittur",0.08465032679738561,0.0720265032828283,0.9153500186274508,0.0808318063131313,,
141,73,11,Paragraph,"[(15, 24), (24, 36), (36, 47), (47, 57), (57, 66), (66, 78), (78, 90)]","Other strategies included using a zero inbox strategy (described in [58] as frequent filers for emails) in which users initially saved most tabs using the on-page Popup View into the Holding Tank (Figure 3), and frequently opened the main Tabs.do interface to subsequently catalog them into projects (Figure 1). Similarly, some used the Holding Tank to keep track of urgent tasks while creating projects to store longer term tasks that had a lower priority (P6):",0.08421078431372549,0.10063333333333331,0.4808456547973856,0.19497601010101015,,
142,73,11,Paragraph,"[(90, 101), (101, 114), (114, 126), (126, 137), (137, 145), (145, 146)]","“Anything that was in the holding tank, I was either moving to the reading list or to one of these projects that I made... I consider the holding tank to be a place where you just throw things [in] so you can organize them... I would feel uncomfortable just leaving things hanging out in there.“– P3",0.1082549019607843,0.20511818181818173,0.45911857292549046,0.2856237373737374,,
143,73,11,Paragraph,"[(146, 157), (157, 167), (167, 176), (176, 187), (187, 198), (198, 202)]","“Projects are, like, I’m gonna get around to watch all that Anime [a project] and I’m gonna do this Art Challenge [another project]. These [my projects] are presents for the future... It’s not an immediate thing. Whereas up here [in the Holding Tank], I’m like, okay, I have code [a task bundle] due tomorrow.” - P6",0.10774183006535948,0.295765909090909,0.4568685339607843,0.37627146464646466,,
144,73,11,Paragraph,"[(202, 211), (211, 222), (222, 234), (234, 243), (243, 254), (254, 266), (266, 276), (276, 285), (285, 292)]","One surprising finding was that few participants used scheduling features of the system, despite their ubiquitous presence in to-do list managers. When we asked about the lack of use of our scheduling feature, participants noted that many of their lower importance tasks do not have clear “deadlines.” For their more important tasks in the browser, they pointed to their existing use of other calendar services (i.e., Google Calendar and the calendar feature in Notion), and instead suggested integration with third-party services as a feature that would make scheduling more useful.",0.08465032679738561,0.3864136363636363,0.4820742713620916,0.5084305555555556,,
145,73,11,Paragraph,"[(292, 302), (302, 315), (315, 327), (327, 339), (339, 347)]","“It’s [scheduling due dates in Tabs.do] kind of useless to me if I can’t see it in my Google Calendar. Any kind of integration in the future would just be great. I kind of live and die by my Google Calendar... If it’s not in my Google Calendar, it’s not really gonna happen” - P6",0.1082549019607843,0.5185727272727272,0.4568685339607843,0.5852424242424242,,
146,73,11,Paragraph,"[(347, 359), (359, 371), (371, 384), (384, 397), (397, 398)]","In sum, we found participants used a wide range of different ap- proaches to better prioritize their tasks in the browser. As a result, participants said they were able to be more focused on the task at hand and not be distracted by all other tasks that they had accumu- lated.",0.08465032679738561,0.5953845959595959,0.48293781479738584,0.6620530303030303,,
147,73,11,Paragraph,"[(398, 408), (408, 415)]","“It’s made me more focused on whatever I’m working on right now, and not distracted. – P1",0.1082549019607843,0.672195202020202,0.45686853396078453,0.6973535353535353,,
148,73,11,Paragraph,"[(415, 426), (426, 436), (436, 449), (449, 461), (461, 465)]","“[The biggest benefit is] being focused on one tab at one given time... [When] you have so many tabs, keep juggling here and there, don’t know what to do. I like to keep life simple, and I want to achieve what I’m doing at that point in time. – P4",0.1082549019607843,0.7074957070707071,0.4568685339607844,0.7741641414141415,,
149,74,11,Section,"(465, 470)",6 DISCUSSION AND FUTURE WORK,0.08465032679738561,0.7907468891414141,0.35311960653594765,0.8033259295454545,,
150,75,11,Paragraph,"[(470, 481), (481, 490), (490, 500), (500, 513), (513, 523)]","In this current work, we explored a task-centric approach to tabbed browsing through a research prototype, Tabs.do. To enable this approach we introduced the tab bundle primitive, and task manage- ment affordances and views built on top of it. In an evaluation study we found that participants using the system found the approach",0.08410784313725489,0.806320202020202,0.48294414402091507,0.8729886363636364,,
151,75,11,Paragraph,"[(523, 532), (532, 544), (544, 550)]","useful, and identified changes in their behavior including decreased tab and window clutter, the creation and use of rich, nested task structures, and frequent context-switching among tasks.",0.5195343137254902,0.10063333333333331,0.9157296417254903,0.1396275252525253,,
152,75,11,Paragraph,"[(550, 560), (560, 570), (570, 581), (581, 589), (589, 600), (600, 610), (610, 620), (620, 628), (628, 640), (640, 651), (651, 655)]","Our results are promising in suggesting that a task-centric approach may be profitably employed in tabbed browsing interfaces. In do- ing so they are consistent with the beneficial use of activity-based computing approaches in other contexts including general task management [6], desktop applications and local files [2, 3, 54], and email [7], and there are strong parallels between these contexts and tabbed browsing (for example, the need for efficient context- switching, reminding and avoiding “black-hole” effects, or collecting lower-priority tasks that they do not expect to complete [6, 13]) that suggest that users might indeed be treating their tabs as elements of larger underlying tasks.",0.5195343137254902,0.14906262626262623,0.9178218017254904,0.2987537878787879,,
153,75,11,Paragraph,"[(655, 665), (665, 677), (677, 687), (687, 696), (696, 706), (706, 718), (718, 728), (728, 739), (739, 750), (750, 760), (760, 773), (773, 782), (782, 791), (791, 794)]","However, there are also interesting differences between tasks in the browser and in other contexts such as email or file systems that may suggest the need for different functionality going forward. One fundamental difference is that many online tasks are inherently exploratory [38], requiring users to proactively seek out and make sense of many different pieces of information [43, 46], not all of which are necessarily useful, and iteratively refine their goals [38]. To design for this fluid task structure, we introduced the concept of tab bundles that allowed users to structure and restructure their tasks to reflect their changing mental models when conducting tasks in the browser, as well as the ability to prioritize and triage collected information. However, further support for refactoring of tasks and managing multiple promising branches is likely an important area for future work.",0.5189918300653594,0.3081876262626263,0.9176010535947716,0.49939015151515154,,
154,75,11,Paragraph,"[(794, 804), (804, 814), (814, 823), (823, 831), (831, 841), (841, 851), (851, 862), (862, 874), (874, 885), (885, 895), (895, 905), (905, 910)]","Prior work in activity-based computing has pointed to benefits in providing users access to their tasks across multiple devices and applications [10, 18]. While the current implementation of Tabs.do synchronizes in-browser tasks across computers, extending it to support mobile devices and other desktop applications could be an interesting directions for future work. For example, task bundles in Tabs.do could potentially be used as basic building blocks to connect applications and devices to build a more holistic system [4, 5]. Such an approach could enable users to schedule and surface a to-read task bundle on their mobile phones during an upcoming commute or seamlessly bundle browser tabs with other local applications or files supporting the same tasks.",0.51909477124183,0.5088239898989898,0.9156236858352943,0.6723522727272726,,
155,75,11,Paragraph,"[(910, 921), (921, 930), (930, 945), (945, 954), (954, 965), (965, 975), (975, 988), (988, 1002), (1002, 1011), (1011, 1020), (1020, 1032), (1032, 1042), (1042, 1053), (1053, 1063)]","Some participants pointed to the possibility of seeing the task bun- dle suggestions directly on the browser interface without switching to the new tab page to see them in the Open Tabs view. One practi- cal challenge we faced when exploring new browser interactions was that current Web Extension APIs have very limited support for changing the interfaces and interactions of browser tabs. For exam- ple, it would be difficult to change the structure or visual saliency of tabs on native UI (such as colors or widths) to surface our tab bundle suggestions with current browser APIs. Participants also pointed to limitations imposed by current Web Extension APIs. For example, Tabs.do used the “saved” badge on the extension icon to show that it was previously saved, but Web Extension APIs lack mechanisms for Tabs.do to further surface statuses or structures that the users assigned to their tabs, such as due dates or projects.",0.5189918300653594,0.6817861111111111,0.9178330536784314,0.8729886363636364,,
156,75,11,Paragraph,"[(1063, 1064)]",12,0.49457026143790844,0.8943739898989899,0.505167702614379,0.9031792929292929,,
157,76,12,Header,"[(0, 5), (5, 13)]","Tabs.do: Task-Centric Browser Tab Management UIST ’21, October 10–14, 2021, Virtual Event, USA",0.08434150326797385,0.0720265032828283,0.9153518179738558,0.0808318063131313,,
158,77,12,Paragraph,"[(13, 23), (23, 35), (35, 47), (47, 54), (54, 68), (68, 78), (78, 88), (88, 98), (98, 109), (109, 120), (120, 132), (132, 142), (142, 152), (152, 166), (166, 174), (174, 183)]","While Tabs.do’s task-centric approach may provide a useful step for- ward in helping people with their online tasks, it represents only one piece of a richer tapestry of functionality that would be necessary to support the complex learning, decision-making, and sensemaking that people engage in on the internet. One way to think of this larger ecosystem might include Tabs.do as a hub for creating, organizing and managing tasks, but with additional functionality on each end. The need for saving clips, snippets, and annotations when exploring unfamiliar information is well documented [14, 32, 39, 49, 50], and supporting the collection of such information in users’ tasks could be an important extension for our approach. On the other end, as users collect more information there is an increasing need for workspaces that can help them structure, compare, synthesize, and take action on it [15, 16, 19, 37, 42, 47]. Enabling Tabs.do to seamlessly pass in- formation and synchronize with specialized workspaces for different types of tasks could be a fruitful future direction.",0.08394607843137254,0.10063333333333331,0.4829421039163398,0.3195088383838384,,
